{
  "schema_version": 1,
  "run_id": "pi-01a125fe-0142-763d-82c7-2f1f2e2650ee",
  "published_at": "2026-10-10T13:30:16Z",
  "visible": true,
  "preview_allowed": true,
  "preview_disabled_reason": null,
  "observations": [],
  "series_publication_complete": true,
  "series_incomplete_reason": null,
  "thumbnail": {
    "path": "thumbnails/pi-01a125fe-0142-763d-82c7-2f1f2e2650ee.webp",
    "viewport": {
      "width": 640,
      "height": 480
    },
    "capture_delay_ms": 1000,
    "browser_version": "156.0.8078.4",
    "preview_policy_version": "restricted-html-v1"
  }
}
