{
  "schema_version": 1,
  "run_id": "agy-5ef17ce4-44c5-4d41-8e84-ebf25ed93d3c-capybara-hoverboard-v1",
  "published_at": "2026-10-12T13:20:00Z",
  "visible": true,
  "preview_allowed": true,
  "preview_disabled_reason": null,
  "observations": [
    "A compact self-contained HTML artifact uses inline SVG and CSS keyframes to animate a capybara riding a hoverboard.",
    "The response contains no JavaScript, external assets, network requests, or audio."
  ],
  "series_publication_complete": true,
  "series_incomplete_reason": null,
  "thumbnail": {
    "path": "thumbnails/agy-5ef17ce4-44c5-4d41-8e84-ebf25ed93d3c-capybara-hoverboard-v1.png",
    "viewport": {
      "width": 640,
      "height": 480
    },
    "capture_delay_ms": 5000,
    "browser_version": "156.0.8078.4",
    "preview_policy_version": "restricted-html-v1"
  }
}
