{
  "schema_version": 1,
  "run_id": "pi-01a12625-8eb6-72a8-8fe0-31810bac58d6",
  "published_at": "2026-10-10T21:47:04Z",
  "visible": true,
  "preview_allowed": true,
  "preview_disabled_reason": null,
  "observations": [
    "Self-contained HTML with inline CSS and JavaScript; no external assets or network requests were found.",
    "Canvas-based animated capybara hoverboard scene with keyboard, mouse, touch, jump, boost, shade, and theme controls."
  ],
  "series_publication_complete": true,
  "series_incomplete_reason": null,
  "thumbnail": {
    "path": "thumbnails/pi-01a12625-8eb6-72a8-8fe0-31810bac58d6.png",
    "viewport": {
      "width": 640,
      "height": 480
    },
    "capture_delay_ms": 1000,
    "browser_version": "156.0.8078.4",
    "preview_policy_version": "restricted-html-v1"
  }
}
