{
  "schema_version": 1,
  "run_id": "pi-01a13428-91a4-73e0-bb65-7ae074cb59a7-capybara-hoverboard-v1-cost",
  "published_at": "2026-10-13T08:49:58Z",
  "visible": true,
  "preview_allowed": true,
  "preview_disabled_reason": null,
  "observations": [
    "The run used five model calls and 96,369 ms of model time.",
    "Pi reported 98,608 total tokens, including 66,176 cached tokens.",
    "The agent created the HTML with tools, corrected one invalid fill value, and performed text-level checks but did not render or browser-test the output.",
    "Reported time: 1m37s.",
    "Reported cost: $0.03."
  ],
  "series_publication_complete": true,
  "series_incomplete_reason": null,
  "thumbnail": {
    "path": "thumbnails/pi-01a13428-91a4-73e0-bb65-7ae074cb59a7-capybara-hoverboard-v1-cost.png",
    "viewport": {
      "width": 640,
      "height": 480
    },
    "capture_delay_ms": 1000,
    "browser_version": "156.0.8078.4",
    "preview_policy_version": "restricted-html-v1"
  }
}
