{
  "schema_version": 1,
  "run_id": "pi-01a125c6-e3d4-704e-977c-822bef6894cd",
  "published_at": "2026-10-10T12:57:02Z",
  "visible": true,
  "preview_allowed": true,
  "preview_disabled_reason": null,
  "observations": [
    "Self-contained HTML with inline CSS and SVG animation.",
    "Depicts a capybara riding a glowing hoverboard in a pastel landscape.",
    "No script tags, external network requests, iframes, forms, or media elements detected."
  ],
  "series_publication_complete": true,
  "series_incomplete_reason": null,
  "thumbnail": {
    "path": "thumbnails/pi-01a125c6-e3d4-704e-977c-822bef6894cd.png",
    "viewport": {
      "width": 640,
      "height": 480
    },
    "capture_delay_ms": 1000,
    "browser_version": "156.0.8078.4",
    "preview_policy_version": "restricted-html-v1"
  }
}
