{
  "schema_version": 1,
  "run_id": "pi-01a13993-0d7d-71b8-9ae0-e251d6760d36-capybara-hoverboard-v1",
  "published_at": "2026-10-14T08:52:25.067Z",
  "visible": true,
  "preview_allowed": true,
  "preview_disabled_reason": null,
  "observations": [
    "Strong one-shot execution: a single model call with no tool use produced a complete, polished experience.",
    "Clear art direction: Capy Cruise and the No hurry. Just hover. framing give the piece a consistent editorial identity instead of a generic demo.",
    "Constraint compliance: the result is a self-contained HTML document with inline SVG, CSS, and JavaScript and no external assets, libraries, fonts, or network requests.",
    "Layered motion includes hovering, leaning, scarf and leaf movement, blinking, cloud drift, glow, shadow, streaks, and boost feedback.",
    "Good accessibility basics include SVG title and description, labeled controls, visible focus states, live mood text, and reduced-motion support.",
    "The main limitation is shallow interaction: the speed control mostly changes streak timing while the rider remains spatially fixed, and boost is a timed animation rather than a deeper movement model.",
    "Mobile support deliberately crops and enlarges the landscape to preserve focus on the rider at the expense of showing the full scene."
  ],
  "series_publication_complete": true,
  "series_incomplete_reason": null,
  "thumbnail": {
    "path": "thumbnails/pi-01a13993-0d7d-71b8-9ae0-e251d6760d36-capybara-hoverboard-v1.png",
    "viewport": {
      "width": 640,
      "height": 480
    },
    "capture_delay_ms": 1000,
    "browser_version": "156.0.8078.4",
    "preview_policy_version": "restricted-html-v1"
  }
}
