{
  "schema_version": 1,
  "run_id": "dsh-adef23f3-d235-4306-93d7-9afaf9df31cf-capybara-hoverboard-v1-elapsed",
  "published_at": "2026-10-13T04:43:58Z",
  "visible": true,
  "preview_allowed": true,
  "preview_disabled_reason": null,
  "observations": [
    "The self-contained scene renders a capybara on a glowing cyan hoverboard against a sunset mountain landscape, with animated stars, clouds, thrusters, particles, and a red scarf.",
    "The interaction code adds pointer parallax and click-to-boost behavior; local observation produced no page errors.",
    "The total recorded DSH cost is US$0.04.",
    "The supplied approximate elapsed duration is 2m22s."
  ],
  "series_publication_complete": true,
  "series_incomplete_reason": null,
  "thumbnail": {
    "path": "thumbnails/dsh-adef23f3-d235-4306-93d7-9afaf9df31cf-capybara-hoverboard-v1-elapsed.png",
    "viewport": {
      "width": 640,
      "height": 480
    },
    "capture_delay_ms": 1000,
    "browser_version": "156.0.8078.4",
    "preview_policy_version": "restricted-html-v1"
  }
}
